{
  "$schema": "http://json-schema.org/draft-07/schema#",
  "title": "Concept",
  "type": "OBJECT",
  "properties": {
    "id": {
      "type": "STRING"
    },
    "title": {
      "type": "STRING"
    },
    "icon": {
      "type": "STRING"
    },
    "description": {
      "type": "STRING"
    },
    "chartImage": {
      "type": "STRING"
    },
    "theoryNote": {
      "type": "STRING"
    }
  },
  "required": ["id", "title", "icon", "description", "chartImage", "theoryNote"]
}
